{
  "files": [
    {
      "filename": "rhetoric-climax.html",
      "format": "html",
      "id": "rhetoric-climax",
      "url": "https://rhetoric.byu.edu/Figures/C/climax.htm"
    }
  ],
  "id": "rhetoric-climax",
  "schema_version": 1,
  "title": "Silva Rhetoricae — climax",
  "version": "live-web-snapshot"
}
