{
  "files": [
    {
      "filename": "adobe-reading.html",
      "format": "html",
      "id": "adobe-reading",
      "url": "https://adobe.design/ideas/how-to-choose-fonts-for-responsive-web-interfaces"
    }
  ],
  "id": "adobe-reading",
  "schema_version": 1,
  "title": "Adobe Design — How to choose fonts for responsive web interfaces",
  "version": "live-web-snapshot"
}
