{
  "files": [
    {
      "filename": "rhetoric-anaphora.html",
      "format": "html",
      "id": "rhetoric-anaphora",
      "url": "https://rhetoric.byu.edu/Figures/A/anaphora.htm"
    }
  ],
  "id": "rhetoric-anaphora",
  "schema_version": 1,
  "title": "Silva Rhetoricae — anaphora",
  "version": "live-web-snapshot"
}
