{
  "files": [
    {
      "filename": "relevance-theory.html",
      "format": "html",
      "id": "relevance-theory",
      "url": "https://www.dan.sperber.fr/?p=93"
    }
  ],
  "id": "relevance-theory",
  "schema_version": 1,
  "title": "Wilson and Sperber — Relevance Theory",
  "version": "2004"
}
