{
  "files": [
    {
      "filename": "purdue-paragraphs.html",
      "format": "html",
      "id": "purdue-paragraphs",
      "url": "https://owl.purdue.edu/owl/general_writing/academic_writing/paragraphs_and_paragraphing/index.html"
    }
  ],
  "id": "purdue-paragraphs",
  "schema_version": 1,
  "title": "purdue-paragraphs",
  "version": "live-web-snapshot"
}
