{
  "files": [
    {
      "filename": "rhetoric-parallelism.html",
      "format": "html",
      "id": "rhetoric-parallelism",
      "url": "https://rhetoric.byu.edu/Figures/P/parallelism.htm"
    }
  ],
  "id": "rhetoric-parallelism",
  "schema_version": 1,
  "title": "Silva Rhetoricae — parallelism",
  "version": "live-web-snapshot"
}
