{
  "files": [
    {
      "filename": "unc-editing.html",
      "format": "html",
      "id": "unc-editing",
      "url": "https://writingcenter.unc.edu/tips-and-tools/editing-and-proofreading/"
    }
  ],
  "id": "unc-editing",
  "schema_version": 1,
  "title": "UNC Writing Center — Editing and Proofreading",
  "version": "live-web-snapshot"
}
