{
  "files": [
    {
      "filename": "rhetoric-litotes.html",
      "format": "html",
      "id": "rhetoric-litotes",
      "url": "https://rhetoric.byu.edu/Figures/L/litotes.htm"
    }
  ],
  "id": "rhetoric-litotes",
  "schema_version": 1,
  "title": "Silva Rhetoricae — litotes",
  "version": "live-web-snapshot"
}
