{
  "files": [
    {
      "filename": "rhetorical-strategies.html",
      "format": "html",
      "id": "rhetorical-strategies",
      "url": "https://owl.purdue.edu/owl/general_writing/academic_writing/establishing_arguments/rhetorical_strategies.html"
    }
  ],
  "id": "rhetorical-strategies",
  "schema_version": 1,
  "title": "Purdue OWL — Rhetorical Strategies",
  "version": "live-web-snapshot"
}
