{
  "files": [
    {
      "filename": "wai-symbols.html",
      "format": "html",
      "id": "wai-symbols",
      "url": "https://www.w3.org/WAI/WCAG22/Techniques/html/H86"
    }
  ],
  "id": "wai-symbols",
  "schema_version": 1,
  "title": "WAI H86 — Text alternatives for emojis, emoticons and ASCII art",
  "version": "live-web-snapshot"
}
