{
  "files": [
    {
      "filename": "narrative-strategies.html",
      "format": "html",
      "id": "narrative-strategies",
      "url": "https://openstax.org/books/writing-guide/pages/4-3-glance-at-genre-conflict-detail-and-revelation"
    }
  ],
  "id": "narrative-strategies",
  "schema_version": 1,
  "title": "OpenStax — Conflict, Detail, and Revelation",
  "version": "live-web-snapshot"
}
