{
  "files": [
    {
      "filename": "rhetoric-ellipsis.html",
      "format": "html",
      "id": "rhetoric-ellipsis",
      "url": "https://rhetoric.byu.edu/Figures/E/ellipsis.htm"
    }
  ],
  "id": "rhetoric-ellipsis",
  "schema_version": 1,
  "title": "Silva Rhetoricae — ellipsis",
  "version": "live-web-snapshot"
}
