{
  "files": [
    {
      "filename": "rhetoric-simile.html",
      "format": "html",
      "id": "rhetoric-simile",
      "url": "https://rhetoric.byu.edu/Figures/S/simile.htm"
    }
  ],
  "id": "rhetoric-simile",
  "schema_version": 1,
  "title": "Silva Rhetoricae — simile",
  "version": "live-web-snapshot"
}
