{
  "files": [
    {
      "filename": "drafting-revision.html",
      "format": "html",
      "id": "drafting-revision",
      "url": "https://openstax.org/books/writing-guide/pages/3-5-writing-process-tracing-the-beginnings-of-literacy"
    }
  ],
  "id": "drafting-revision",
  "schema_version": 1,
  "title": "OpenStax — Writing Process: Tracing the Beginnings of Literacy",
  "version": "live-web-snapshot"
}
