{
  "files": [
    {
      "filename": "rst-introduction.html",
      "format": "html",
      "id": "rst-introduction",
      "url": "https://www.sfu.ca/rst/01intro/intro.html"
    }
  ],
  "id": "rst-introduction",
  "schema_version": 1,
  "title": "Rhetorical Structure Theory — Introduction",
  "version": "live-web-snapshot"
}
