{
  "files": [
    {
      "filename": "evergreen-notes.html",
      "format": "html",
      "id": "evergreen-notes",
      "url": "https://notes.andymatuschak.org/Evergreen_notes"
    }
  ],
  "id": "evergreen-notes",
  "schema_version": 1,
  "title": "evergreen-notes",
  "version": "live-web-snapshot"
}
